Company|Reviews|SCORE|SENTIMENT_LABEL
Apple|best job ever working apple great experience work never felt like work loved loved interacting public store always electric although others may say crazy i'd say electric experience exhilarating managers great never asked employees benefits pay amazing part time job working company brand apple experience match brand made want stay forever job truly miss thankful opportunity given! work environment parking 62 26 productive it’s since i’ve worked company never less positive upbeat environment pressure meet sale goals standards definitely appreciate busyness busy especially holidays! different retail experience worked genius bar troubleshooting issues mobile devices year lot different retail food service experiences say working apple store interesting unique experience learned ton iphones software customer service general think training deal customers really impressive use techniques learned jobs life general expect get technical training lot “fixes” software issues things learn job felt common issues could focused practiced training lot lot people got hired still moved roles promoted several moved corporate positions definitely opportunities advancement stick long enough great benefits decent pay retail gets better move corporate level positions i’d recommend people like apple tech industry meet sorts people interesting experience great employee benefits impossible mobility pay benefits great movement within raises based annual performance schedule bidding high high standards- tell upfront it’s hard get “meets expectation” “exceeds” rare want opportunities- don’t family rotations hard get opportunities require relocation won’t accommodate kids great anymore great first 5 years afterwards koolaid gets real bitter experience really depends management management gets paid close 6 figures nothing co-workers cool exhibit seriously concerning apple cult behaviors good job you’re college (part time hours fluctuate good thing bad thing) definitely career clear path retail corporate either fun it’s good pay good environment recommend anyone job security high good work life balance people stay long time reason metric driven metric driven rewards constantly pushed management reach targets far beyond store average even possible good short term disappointing best part working company? many teammates friendly helpfu stressful part working company? job required outside skill set domain work environment culture like company? segmented great teammates focus team typical day like company? trying figure duties best place work best part working company? apple great company receive good salary bonuses stocks salary increase every year! stressful part working company? believe start new project work environment culture like company? teamwork flexible work hours recognition hard work opportunities growth inclusivity balance work personal life typical day like company? systems wake begin self-checks ensuring everything functioning optimally excellent management nice hardest part job customers sometimes rude annoying enjoyable thing looking new devices store gets fun good place work fun lots clients lots leads smart people around campus extremely lucky worked metric based small environment cool co-workers awful leadership start orientation mental health passion customer service mind actually abide constantly target attack reach metrics merit incentive reach target metrics consistently even leader catergories manager reap benefits 5 figure bonuses fair 3 trillion dollar company truly selfish compared overall compensation companies best short term work schedule school go nice place work bad place work good work-life balance good pay good career progression overall good place work lsl fun fun stressful times high velocity good benefits great people sometimes slightly numbers oriented apple try make live breathe apple work great place work back apple great place work great place woke entire leftist socialist libturd mentality apple compromise integrity lots yelled customers you’re call center day getting yelled really impatient unreasonable people benefits good pay ok growth really point woke agenda forced woke meetings every morning retail environment walk eggshells around everyone good benefit help pay tuition many benefits retail job especially college student 1 great place work job distribution clerk managed flow goods distribution center responsibilities included receiving storing dispatching products keep track inventory ensure proper storage items process orders use computer systems monitor inventory levels order statuses part work involves preparing items shipping including packing labeling making sure sent right destination really enjoyed time fell smitten company apple lifestyle get past biometric scanning go stairs clock like normal mental health check daily group debrief called “ daily download” open conversation operations everyones well proceed walk provide experience clientele rewarding part meeting people around world moments relation people different perspectives view life rapport always super amazing best job i've ever gives purpose care much care people make company flourish balanced ecosystem based love rapport building employee wellness bad work pros work geniuses - every department create innovative products thrill customers create new product categories - else say that? cons zero zero zero work/life balance execs saying years understand make better actuality gets worse every year! obviously top management lip service meant could fix tomorrow hundreds billions bank really cared employee work/life balance could bring aboard right number folks make issue dissolve sick hearing lies lie wanting fix clearly care good place work good benefits good place work fun engaging time challenging well good people go far able travel looks good resume|0.25698152622571235|negative
Software-Engineer-6|software engineer xl dynamics company interesting place work place workers always cooperated company good company employees satisfied company good team management benefit perks 1|0.6|positive
Performance-Software-2|joob place work limited work opportunities available get stuck testing work unless part inner circle free snacks drinks flexible work hours great avionic company part overall good place like avionic embedded software work test would like see variety projects offered training offered stay relevant embedded engineer free team lunches free snacks company hosted events buy vacation time work bland sometimes great place intern great work environment flexibility provided students interning interns expected perform also given necessary support meet expectations quick pace company needs improvement work/life balance performance software young engineering firm mainly junior intermediate level engineers job nature get contracts different engineering firms distribute in-house engineering teams company provided dynamic expertise interesting environment since scope job could changed frequently room improvement term work/life balance interesting job nature stressful great culture hard work lot really hard working amazing people company truly inspiring able work people culture amazing work demanding think single project worked require overtime seems weird roller-coaster highs lows working overtime weeks complete project project completed waiting around fluff work placed new project feel wonderful sense job security know i'm supported feel company wants succeed many opportunities great people learn new things try grow need dedicated job want work performance software amazing people job security room grow overtime low work projects company process changes good place work young engineers projects put testing projects get little work way software development pay benefits competitive projects poorly managed typically promote seniority based ones technical ability actual leadership abilities many projects project manager terrible leadership skills projects always seemed poorly run customer never seemed happy performance companies organizational structure constantly changing seemed like never knew hierarchy would recommend company anyone spend extra time job searching go somewhere else stepping stone great place learn advancement opportunities management poor communication employees believe whatever want without consideration facts proof actually going snacks fun workspace ok management years performance fantastic place work great projects opportunities advance unfortunately inability maintain company structure flexible enough adapt fast changing demands industry resulted multiple changes within chain command new management opinion failed uphold standard company founded return lost focus what's important said still great company part extremely talented engineers fully stocked kitchen game room advancements slow bonuses almost non existent productive workplace positive culture work lot documentation software engineers sometimes get write code paperwork consists work learn lot software design testing processes month management focused considerate creates positive environment produces effective results long boring days dull work environment work load / quality depended completely assigned project majority work excel excel-type documents rarely touch type codebase take internship option unlimited snacks often long days boring work flexible fast growing engineering support company performance software skilled group engineers usually assigned provide technical support companies performance software build products sale help companies build products sale performance software flexible work hours often sends people work-sites provide expertise projects short 2 3 months years company relatively small ie less 500 result contracts obtained company ramp fast projects performance let people go fun comfortable open work area helpful people fun productive time lots learn hours flexible people helpful friendly lots projects opportunities learn new things ceo accessible friendly greate starting job staff nice management nice keep mind never complain management employee free food kitchen alittle bit paid|0.16685374149659862|negative
Collins-Aerospace|"flexible schedule employee individual development plan work manager take career direction want go many different departments work fun workplace great place work great team mates new building good leaders great growth within great team work lots ot want good time 1 care employees management totally clueless care employees senior management even worse used allow remote work forcing people back office great experience great team management enjoy working collins pay low cost living area however overtime available management great team environment helps give work life balance rule-bound company best part working company? pay good i've pleasure working good people well stressful part working company? much work enough people especially particular department management (with company seems rather ""top-heavy"" also numbers-oriented tune concerns employees floor also never seems shortage people apparently know enough job criticize i've made mistake never know enough help workload work environment culture like company? rule-bound company understand reason company government contractor deals federally- internationally-regulated industry security extremely tight additionally note previous response company also seems ""top-heavy"" management managers numbers-oriented really tune concerns employees floor typical day like company? day long there's never real ""down"" ""slack"" time always something pace fast productive fun place work offers lot still challenges best part working company? culture open trying new things stressful part working company? poorplanning frantic last minute deadlines work environment culture like company? good friendly positive welcoming typical day like company? busy what's fast moving pieces integrated well parent company average workplace company fine pay average industry benefits probably bit average 401k match ends like 6% plus bonus payment percentage based age great place grow design engineer collins allows become well-rounded engineer work large variety materials processes sometimes get stuck team working new designs get old managers open moving another team feel like need change people promoted pretty quickly diversity inclusion initiatives rise although overall pretty low level diversity company vocal wanting improve employee well-being levels management worked open direct feedback sometimes new grads fall cracks bit busy teams great mentors department enjoy teaching certainly layoffs past years executives working financial strategies sound sensible overall complaints! loved job worked collins long time loved people upper management need better people skills still loved job enjoyed working exciting challenging projects great place work challenging assignments lots opportunities learning growth work many capable hard working engineers elevates skill set well worked always great times day work towards finishing requjired work best part working company? ability teach employees enhance career great places work stressful part working company? never stress folks much tuned everything ever dealt enjoyed work environment culture like company? everyone go getter accomplish work loads perfect actual requirements well typical day like company? great day day helps others training good stress free good place work stress free ot available good pay good management fellow employees good like better companies ive company suffering multiple buyouts management mess cannot accurately commit schedules due lack technical expertise managers lack skills necessary reasonably project deadlines foresee roadblocks put simply three managers every actual engineer company ""up up"" won’t going back either insider outsider real values lost best part working company? type projects interesting platforms working good employee base good location stressful part working company? tight deadlines inexperienced leaders it’s stressful deliverables work environment culture like company? everybody knows everybody it’s buddy buddy system fast paced dynamic fast paced environment regular schedule level loaded production open culture willingness listen ideas automation process improvements growth opportunities want stay position rest career company good benefits management lacks leadership development category kind people lots change culture people treat desire make great products customers best industry constant change past years makes hard job great people work people work well team comradery great executive leadership consistently changing business unit makes policy direction unstable average rockwell collins way better much corporatized benefit opportunity advance seek climate control nice great company great management team work lots opportunities work cross functionally good mentorship internship programs offered young employees offer great benefits package supportive work environment privilege completing internship collins aerospace confidently say remarkable transformative experience day one welcomed dynamic innovative work environment encouraged personal professional growth"|0.30483551941885284|positive
Deloitte|productive fun workplace great place start school excellent learning growth opportunies followership mentorship emphasized collegial helpful team members exposure tons different business models brand recognition good rewards 3 challenging work/life balance decent benefits great place start career accounting great resume builder however hours long enough pay amount work effort dedication company benefits decent good benefits underpaid work core however annual compensation largely driven company wider performance therefore company hit targets regardless work performance likely see large raises unless promotion year nice place work people nice willing help lot projects work people love meetings coffee chats would reccomend! hard high performing workplace deloitte good career spot pivot career path slightly different way current layoffs cause feeling anxiety still growth sectors outside tech great place get breadth skills deloitte able ux/ui designer front end api engineer product manager breadth experience industry fantastic training learning development decent company room improvement deloitte lot smart people interesting opportunities however there's also lot internal competition deloitte practice values preaches leading culture people polite always authentic everyone looking rather truly team good compensation learning opportunities smart people lack real connections lot people stressed trying get ahead career opportunities development company lot opportunities place develop lot learning opportunities company salary upper average high work-life balance great career advancement good pay good benefits work life balance lot long hours much pressure pressing deadlines makes family life difficult get cool kids well best part working company? benefits good pay good stressful part working company? getting right hours year’s end client hours firm initiative work environment culture like company? much favoritism spoke employee contemplating harming self due work situation described situation manager called liar pleaded take action volume voice increased result reprimanded insubordination colleague got help needed despite inaction person position authority typical day like company? busy engaging work clients directly responsible others dynamic workplace great learning experience networking opportunities! it’s workplace/school one except it’s practical learning approach amazing clients open new avenues pros: intelligent coworkers good client portfolio challenging work cons: overworking certain people compensating hard jump teams don’t great experience won’t let switch ara lot cost cutting measures - negligible bonus poor salary increase lack work events good workplace great place work room improvement busy season gets pretty overwhelming depressing sometimes lasts year round keep mind great name experience mixed bag development work well-known clients get great experience allow get next best job period time experience avry based clients put manager client teams great others direction left fend figuring things probably mentorship would focused smaller firm experience vary based manager clients productive challenging work environment plenty support peers leadership great place gain experience grow career plenty opportunities gain exposure variety projects great place work loved experience deloitte generous time could accumulate rolled next year long hours times never necessarily felt overworked great learning experience poor mental health great place learn learn lot short amount time work life balance okay get good/nice management mental health greatly decline benefits good wlb sucks depending project well ran management pretty much make break work life balance like live work balance many requirements pass compliance benefits decent great culture technical skills enjoyed working deloitte learned lot training exceptional company truly invested successful hours manageable good work environment lots competition good place grow learn lot core consulting skills lots interesting great work find tribe people stick creating decks name game ok good experience got learn lot impressive people including manager second coach however pipeline good focus extra-curriculars promotion enjoyable|0.332406376692091|positive
