Company|Reviews|SCORE|SENTIMENT_LABEL
Meta-dd1502f2|"best experience career unfortunately victim large layoff soon hired best part working company? exceptional co-workers nurturing collaborative environment stressful part working company? layoffs uncertainty future layoffs work environment culture like company? support remote workers excellent easy use useful proprietary tools typical day like company? varied widely great deal flexibility meetings generally worthwhile 3 1 many layoffs don’t feel safe amount layoffs plus don’t trust management going layoffs thousands people repost job months later? better leadership unsatisfactory i'd accepted opportunity knew full picture advance best part working company? working capable colleagues passion stressful part working company? lots turmoil resulting layoffs inconsistent direction senior leadership also company truly value diversity equity inclusion even though ""talk"" like work environment culture like company? tumultuous competitive inconsistent (eg committed remote work indicating 50% would work remotely next years ""about-face"" gave edict 3 days office mandatory) typical day like company? busy lots meetings accountabilities however company adequate technological tools drive efficiency 6 odd culture vague goals toxic leadership great comp hired reality labs boom public many billions losing led layoffs performance graded upon people think obtain friends/allies vs actual discrete measurable indicators comp great like actually getting things done ownership particular area vs insecure mgmt ever changing top-down directives constant backstabbing psc evaluation look elsewhere poor company best part working company? nothing work directline stressful part working company? communication company's hr lousy slow get back work environment culture like company? good management lack communication directon typical day like company? hurry hurry wait wait management decisions everything looks wonderful working couple years lipstick pig food games youth campus looks nice reality sets far 1 leadership source toxic culture slew people working hard make lots money meta guise connecting world causes set disillusionment problems reality sets 2 hr team much everyday work experience constant bombardment “justify messaging concern” guise making impact something much workforce cynical pervasive ever-there ever lingering presence 3 company always changing focus chasing next big thing why? see point one fix world issues serves one purpose put ads people face 4 meta hire role players hires top talent result many cooks every thing smallest issues many opinions options enough role players makes working life miserable 5 commitment people lots lip service good job selling new hires idea “this company” everything free mind would tell get hired rouse make devote ever company trying make mountain money good benefits pay apply software engineers company disorganized burn ton energy trying figure constant scrutiny high stress constantly shifting policies cutting edge technology best environment constantly learning vast amount resources exposure aspects software development internal sources learn cutting edge technologies technical expertise unprofessional hr/management side things best part working company? worked 6 months laid due covid-19 tried come back made lie said fell asleep job longer interested litterally got check 2k laid us everyone stressful part working company? nothing really stressful job great work environment culture like company? strict always toes typical day like company? grouping team working alongside others complete tasks amazing workplace competent coworkers research engineer work depends specific team working however general outline typical day might look like: arrive work grab breakfast needed start working days start meeting team track project's progress start working issues/todos assigned stuck reach one seniors researchers working project ask help afternoon go meet friends lunch together dessert finished get back work keep working till evening leave work head home relax spend time family friends pursue hobbies interests work hard play hard productive high bar aspire however smile face jokes playful banter daily occurrences included last round layoffs even though last two perf cycles exceeds expectations worked 9 years grateful friends experience imagine end workd feels like vacuum kindness respect best part working company? ship without leadership captain completely listless without regard people direction stressful part working company? failure provide work failure perform constant layoffs lack leadership accountability work environment culture like company? stressful inauthentic frat boy worship ceo hunger games atmosphere typical day like company? scrounging work countless rescheduled meetings bobgoals expectations support needed really liked working company kind wonderful people provide excellent service pay fairly time give many incentives ambiente muy rápido orgnico esta empresa es una empresa gigante pero que sigue operando como una start en momentos todo parece un caos pero de alguna manera los problemas son resueltos love matter appreciate long ceo driving love working meta empowered create work life balance drive career forward ball completely court anything falling short work manager fix thing don’t like right uncertainty layoffs constantly air layoffs could ever subside would love get back living work company fully remote work encouraged management excellent it’s easy get promoted move tons opportunity advancement rewarding work layoffs create uncertainty cause stress teams making difficult navigate relationships team dynamics right 4 stars best part working company? work life balance perks metaverse projects stressful part working company? high standard - pressure meet deadlines & numbers! work environment culture like company? amazing come accepted great compensation benefits maybe sunsetting still great used demoralizing negative press good people good benefits best health insurance benefits consolidated using great portal job advancement necessary ic5 great health insurance highly bureaucratic bad feel pressure overall bad lot smart coworkers however true psc driven culture made things weird people chase ""impact"" productive need customer focused developers highly productive need customer focused (documentation software support software developers highly skilled role need understand total impact software user perspective good pay short-term focused great pay benefits awful everything else"|0.21031116534472244|negative
Oracle|great work life balance awesome benefits best part working company? benefits professional development stressful part working company? sales attainment kpis work environment culture like company? great corporate friendly light good balance typical day like company? morning huddle daily activities end day meetings good think working fine complaints short time good manager typical large public company lots staff employees good wlb stingy raises can't complain much work good tech stack bit dated generally free handle business day something expect yearly base raises fall quickly market good wlb average work bad management pros good place learn access learning materials including business technical oracle 3rd parties: books classes courses etc flexible work home office mix regional roles provides access exposed different countries cultures cons hr processes talent evaluation appraisals effective salary increase promotions freeze since ever happens exceptional basis get increase promotion encouraged management bring offer another company advice management want retain talents proactively find talented people embrace make sure stay hr function limited payroll absence easy people work meetings tasks straight forward people nice enough help grateful able work oracle time dhjjvtg ffv global leader public health & health promotion cdc agency americans trust lives addition everyday work cdc employee role supporting public health emergency management whether temporary assignments emergency responses sustaining cdc programs activities colleagues respond join team use talent training & passion help cdc continue world's premier public health organization great people great experience working oracle retail; great people good culture many changes middle management required prove knowledge new manager constantly good benefits stressful worked consulting development support consulting least stressful (dare say) fun development stress offset enjoyment work support extremely stressful complete overload work area severely understaffed great people company great people! caring individuals met wonderful friends working lot people understanding oracle mature company growing steady fun place work life balance great oracle pure software product company work oracle (software provider) little different working consumer diversity pay oracle good place work know want best part working company? oracle provides lot opportunity train expand skill set offer tools stressful part working company? lack leadership guidance use tools provide tools remains unclear employee focus areas really needed companies strategy go learning path pick encouragement day day manager path valued strategy future work yet offered encouraged pursue seems like disconnect work environment culture like company? typical cubicle layout low wall cubicles teams try sit together enhance collaboration often time distracting background talking trying focus applications conversations person phone typical day like company? facility support mailroom support role receive deliver packages couriers fedex ups us postal deliver staff assist building maintenance issues little-to-no upward mobility raises future prospects joined oracle part acquisition previous company great yearly raises plenty opportunities growth oracle came raise promotion freeze end sight little communication oracle leadership direct leadership overall appearances new company caring old company’s employees unconfirmed suspect working towards outsourcing department entirely bad think employees mental well work/life balance put place correct systems training learn develop tools critical job oracle review far experience expected pay could better could improve growth opportunities experience pretty much make great wlb! great work life balance interesting work cloud apps would love work time future sales marketing roles mass lay-offs make hard trust company worked oracle year abruptly laid prior notice assured lay performance-based (it seemed part massive line lay-offs oracle participated 2022) unfortunately company like rest big tech giants; hire many staff members obsess metrics targets afraid trim workforce meet goals perfectly acceptable company work 2/10 recommend great place start would recommend staying growing within company gain experience leave within 1 2 years might get laid anyway productive work fun place people different perspectives working earn money people make money improve reputation people want liked respect earning money community accept respect sometimes working satisfaction enough daily life pay bills rent people earn enough money fulfill basic needs even though it’s satisfying reach dreams make people work money future relaxing seeing children’s well-educated happy earning money becomes much important survive expensive world least people care spiritual satisfaction work people celebrate feel less irritated others celebrate enjoy good place needs paid since new hires making 3-5 hour started 27 hour new hires bat making 30 hour oracle stated raises year next… great company oracle solid leadership teams care people support employees professional personal lives lives promote career growth great people raises great place start disorganization much learn culture iffy w/ layoffs many sectors remote options room raises next year despite profit|0.2475554554934117|negative
Cognizant-Technology-Solutions|"good work life balance work life balance really great compensation better benefits good (ie 401k match health dental life insurance annual bonus company stocks etc) room growth overall ability work home pay great benefits leave excellent however room grow professionally bureaucratic difficult implement change work easy complaints one easiest jobs i’ve ever management best lot selfish mindsets keep head work life good overly rigid structure successful try came cognizant small company acquired processes different challenge marry two also lot leadership turnover last years required role requests leadership seem change constantly successful work understand overall structure needs company frustrating used working large organization said find job enjoy ok dealing large company politics fine place work prefer ""boutique"" ""agency"" work environment happy cognizant local management good national management goals line best part working company? inclusive benefits package good stressful part working company? pressure high work output wanting compensate matching wage good place work good compensation good place work good compensation lot opportunities grow based upon associates strengths good place learn new technologies work great industry leaders lot opportunities looking opportunities platform grow getting right project helps grow good onsite opportunities also stick project perform well learned lot hindsight stress took tremendous toll wellbeing wasn’t worth best part working company? many people worked great stressful part working company? leadership lack respect jr associates misogyny favoritism work environment culture like company? wasn’t great leaders verticals supported incredibly dishonest prospects clients staff typical day like company? long unpredictable & often projects landing lap last minute impossible deadlines productive fun work environment worked cognizant 4 months project-based account overall experience good except salary week coming every salary dispute even though company top-notch hr finance sucks cognizant offers highest base pay industry ceiling also profit sharing twice year salary increase yearly amazing think cognizant need take look hr finance department departments leave bad mark company last pay take 2 months - absurd reach hr finance department reply emails reply typical ai reply free lunch overtime hourly pay hr reply emails unless call company resume hurt you! add cognizant innovation streamlined work environment fostered persistent misaligned resources inability deliver effectively clients recommend working company work home poorest leadership i've ever seen workplace delivery customers employees best part working company? proceed team members discuss schedule stressful part working company? replacement workflow company work environment culture like company? teamwork leadership achievement typical day like company? communication leadership skills team building good company good company work ! benefits great learning opportunities plenty lot internal mobility growth promotion many remote opportunities one best business one best business good work culture everyday good learning curve management good always supportive throughout career okay work opportunity okay work opportunity nothing stands companies huge lack work recognition focus annual profits stressful place work systems difficult navigate best part working company? scattered operation care much people allocate projects great place work resigned 6 months stressful part working company? lack client focus fully remote environment nice team management friendly great options explore technologies good place work highly recommend join cognizant great clients benefits 401k health care benefits employee family never accept contract position best part working company? much way underpaid lost sla fb stressful part working company? lack support managers! work environment culture like company? collaborative really young miss you! managed 25 typical day like company? busy free lunches fb best part day best fun place great lovely place work enjoyed culture got support encouragement management worked different regions various clients able recognise well good company beginners good company starting career train well put projects good work culture lot depends boss productive fun working different clients sometimes site shore shake hand calls late night otherwise good get good pay company offers health benifits 401k benifits great place work provides great working environment opportunities learn grow pursue career aspirations wide range technology business domains work"|0.3778779079998591|positive
Warner-Bros.-Discovery-1|great benefits - lot churn merger warner brothers discovery merged lot churn combining two organizations one eventually caught layoffs september 2023 overall good place work real negative senior leadership seem trust people - deployment process public-facing apps extremely rigid complicated siloed stressful long hours toxic culture constant shift management lots politics toxic work environment wouldn’t recommend normal work 12-14 hour days never receive appreciation always expected within impossible deadlines high pressure low reward 1 productive remote woerk great people learn new skills work great titles best part working company? great people good communication remote work stressful part working company? lots work stressful work environment culture like company? great communication positive attitude inclusive kind typical day like company? everyday different usually list projects tackle 1 good salary political like high school part original discovery click appreciated voice heard great place work! far one best jobs i've ever had! culture changed lot since merger overall great place work loved clients well good company great talent people culture wbd make company great place work business experienced many significant disruptions past years due mergers challenges hopefully diminishing integration continues post-merger downfall toxic work environment low pay constant layoffs used fun company work went downhill merger huge lack communication across departments unclear direction leadership okay harry potter new york associate- store chaotic high foot traffic mainly tourists get stressful high turnover rate store constant changes associate rules leadership structure store construction it’s clearly new lot kinks work pay benefits great made some-what worth discovery erased brand uniqueness identity turner warnermedia blast work air excitement leadership always made best efforts accommodate employees enter discovery: mindless enforced mandates complete disregard impacts brands employees place gutted flagship brands forced background e-level leadership tone-deaf issues facing employees fun work environment somber quiet successes legacy employees achieved claimed discovery brain-drain occuring signs stopping bottom line leadership talks talk diversity inclusion show exclude employees agree discovery echo-chamber vehemently gas-light anyone brave enough speak everyone miserable except execs act like best thing ever happen company exact opposite reason logic gone leadership works serve employees laughable notion top work want pleasant work environment turning sweat-shop ceo used fun agonizing drone creating mentality actively dehumanizes employees perfect work balance attaining harmonious work-life equilibrium enjoying fair satisfactory salary alongside amiable colleagues contributes ideal professional environment fulfilling job provide platform personal growth learning shaping positive enriching journey striking right balance work personal life paramount overall well-being allowing individuals thrive professionally personally equally crucial compensated adequately one's efforts ensuring financial stability contentment conducive work atmosphere pleasant coworkers fosters collaboration camaraderie enhancing job satisfaction productivity moreover great job offers ample opportunities learning skill development promoting continuous growth honing expertise combination elements creates optimal work scenario promoting happiness growth fulfillment professional realm great company workd for! people wonderful environment friendly inspiring supportive ethical organized business oriented focused creative team style responsive attentive concerned great benefits healthcare holidays vacation extra time spend family downsizing office space relocated often great content fun work bad management type work get part unparalleled probably never learn career management leadership toxic unrealistic asks deadlines lot micromanagement corporate posturing merger ruined two good companies best part working company? wbd plethora iconic fun content work stressful part working company? merger absolute mess strategy generating free cash flow many employees say it’s like game musical chairs titanic amazing people laid daily without vision clarity business succeed work environment culture like company? competitive watch back culture completely gone typical day like company? budgets slashed colleagues depend exited search replacements staff sleep office keep volume work inviting culture supportive teammates able communicate needs progress often effectively teammates helped enable individual contributor internship training serious work broad bases information security nonetheless properly covered frequent employee engagement managers supervisors teammates plus extremely supportive training material guarantee future positions made job search post-internship long difficult overall good experience multiple mergers downsizing cost cutting measures increased workloads employees also reduced quality benefits however remaining employees great colleagues it’s still enjoyable place go work every day productive fun workplace provided ample opportunity innovate internal programs inclusion belonging benefits included onsite gym good healthcare on-the-job learning good place start overall people kind helpful management pain pay decent great networking good name resume turn overrate high used good good discovery totally sucked life company live life constantly cutting jobs cutting budgets lot changed couple painful mergers company enjoyed working longer unfortunate new ceo main concern profit inflated paycheck unstable work environment every day new adventure cnn large family journalists care impact news leaders facts first anything else great benefits package flexible schedules amazing cafe even better workers up-to-date facility great pay vacation time overall best place ever worked recommend warner bros discovery great bonuses sometimes work holidays constant changes/layoffs due merger used fun place work great team remote policy flexible time-off lot changed since merger discover rto policy enforced|0.26690867003366997|positive
Bayone-Solutions|nice place work - good product - large scale experience - ability learn technologies like reactnative shifu electrode - analytics tools like splunk medusa 1 1 bayone solutions worst company work fraudster company work bay area paying contractor timelyi paid 2 weeks still get money fraudd know cheat employee steal contractors money 20|0.1285714285714285|negative
