Company|Reviews|SCORE|SENTIMENT_LABEL
CACI-International-1|nice place work great company work benefits great terms medical time-off management great easy advance areas virtual university take courses free 11 8 thank review! incredibly proud accomplished terms continuous learning via virtual university communities practice! learned work non stop meet minamal requirement production best part working company? great benefits great moral values employees stressful part working company? worked airforce veterans push hard hit big numbers daily performance work environment culture like company? sometimes toxic due 2 bosses assigned 90% medical equipment typical day like company? come slightly early take short lunch continue push end day 1 cancel culture alive well management unprofessional management unethical intentionally lie play major head games also keep two sets books one one client clueless play cancel culture games run place none run away place everything 3 mostly great people great job good challenging sometimes work things don’t care know anything that’s life general real issue isn’t lot training paperwork properly? part code base what? things like probably taught early love middle management helpful knowledgeable everything upper management hard get read don’t really talk much unlimited pto long approved pretty nice fto rather pto good management good coworkers little training negative good company grow best part working company? good place build career spent 12 years got nowhere stressful part working company? career growth training opportunities work environment culture like company? culture basically body shop interested making money productive fun work best part working company? security benefits pay well stressful part working company? position requires nothing caci work environment culture like company? professional helpful needs typical day like company? busy progress achievement caci managed children (at levels) senior-level management run children zero insight concern happening account level raise concerns ways fix problems ignored customer frustrated program-level accounting challenge caci senior-level managers nothing fix problem program managers also clueless going customer say yes instead trying determine customer wants needs task order leads junior-level resources idea develop manage task order bus/tech strategy deliver customer i'm glad moved 5 years dealing caci nonsense new company actually clue real eye-opener see well managed customer challenges successfully deliver customer pay decent management awful senior mgmt care productive professional work environment skills talent recognized best part working company? great management support overall benefits plan including 401k stock option contributions stressful part working company? stress arrival time work site reasonably flexible long 8 hours day put right alleviated traffic induced stress made productive work day work environment culture like company? location worked job performed relaxed yet professional mission-oriented productivity first foremost pace production reasonable everyone got along fabulously typical day like company? show get situated check email message traffic check colleagues get work pay best demand much either caci something reputation relatively low salaries quiet part tremendous amount work asked individual employee best workers rise coasters coast content make willing minimum expected roll expect sufficient compensation expect direct correlation going above-and-beyond getting soaring promotion track sometimes get saddled extra work flexible hours option time easy manage deployment arrangements chaotic compensation lackluster detailed required best part working company? flexibility different types jobs stressful part working company? employees getting supervisory support regular work environment culture like company? work environment multiple tasks online training culture high tech customer service help desk technical support typical day like company? receiving spreadsheet request create certificate registration instructions answering inquiries responding emails missed opportunities much opportunity tj decent place overrun pill popping edible minds best part working company? lots resources opportunities work different locations nearly impossible land job unless know someone stressful part working company? watching toxic people get away everything toxic people didn’t appreciate caci able scare decent people away offsite managers hr lies listens squeaky wheels vs reality work environment culture like company? toxic many layers big many young people think right don’t want learn older people experience typical day like company? anti social environment asking someone abojt day offensive i’m think business unit trash good company work best part working company? excellent management believes team building leadership skills stressful part working company? tasks time sensitive require effort work environment culture like company? management open door policy allows easy communication typical day like company? working long hours enjoying day caci company wants employees advance focus customer satisfaction best part working company? always room grow work hard efforts noticed times rewarded stressful part working company? worked government customer demanding team aspect 5he company definitely helped alleviate said stress work environment culture like company? uplifting positive work hard/play hard surrounded lot military veterans everyone earth great place work management excellent best part working company? treat employees respect make feel valued stressful part working company? little stress worth mentioning work environment culture like company?|0.2564967040535221|negative
L3harris|"sum one sentence would sentence best part working company? part world changing innovation stressful part working company? tens thousands customers world limit functionality due security work environment culture like company? professional quite well structured typical day like company? environment allows work work hired complete lot micro managing nice hours bad health company 2 years (luckily leave) mentioned bad build hours 40 80 flight hours month schedule time make sense work miserable pay management snakes want world give nothing nice example: always helping management trouble students extra lessons never got minimal kind help back decide work good luck things changed lot last 2 years best minimal area internal advancement unless get training outside company unlikely make sort personal progression even actively talk upper management you’re likely get anything unless friends somebody area would never work best part working company? benefits (sort of) there’s “unlimited pto” manager allows get 200 hours managers allow 160 hours it’s “discretion” don’t really entitled pto stressful part working company? management wilmington would never work site inefficient raising concerns fall deaf ears hr basically useless work environment culture like company? toxic that’s summary wilmington site typical day like company? one day looks probably looks nothing like tasks hired good best part working company? friendly atmosphere people supportive stressful part working company? many layers management change difficult work environment culture like company? friendly cohesive depending plant one different culture typical day like company? help others use data make decisions exciting projects poor management poor performers penalized incentive improve contracts often delayed cancelled product finished work often hard find work overhead projects borderline demeaning old boys club (well number years agoso know things changed since then?) typical old boys club much top-down middle management show lots unfair favoritism buddies scapegoating others probably 10% managers technically proficient like player-coaches rest played office politics shared social circles buck gets passed engineers take ownership yet given power defining projects lol perpetual understaffing overtime became norm work/life balance joke although least get paid ot middle-aged guy lived office suffering major health crisis death every months chalk downsizing guess probably different legacy corporations today fair? it’s alright days spent waiting work versus days worked definitely didn’t correlate well offered job gave someone else left without means pay bills didn’t care explained going yet instead working let go also workers snakes always watch back company good pay management hr co-workers must someone looking growth someone wants part something great! best part working company? lots room growth opportunities stressful part working company? nothing well established company clear procedures rules follow work environment culture like company? awesome inclusive understanding different cultures typical day like company? start 730 finish 430 every friday 9/80 schedule great products poor leadership morals best part working company? great technology end products stressful part working company? extremely poor follow discrimination complaints follow-up directed employee employee bring discrimination harassment senior leader leadership everything push employee bury complaint leadership work environment culture like company? planning tools required successfully perform job hand employees constantly put ""no win"" situations criticized meeting typical day like company? 10 12 hours comradery 50% turnover supply chain functional areas overall would give pluses minuses review days tough find happily ever engineers best part working company? flexibility working hours long get good work accomplished help move business forward l3 harris good people worker bee level makes worth stressful part working company? managerial pressure perform period lack work plate idl (indirect labor- overhead) charged gives impression might canned next business down-turn work environment culture like company? general good working people mostly good managerial level constant emphasis positive c ash flow stressful better permanent becomes much better work environment become permanent employee long make initial temporary employee position good hybrid schedule lots help ask culture dry probably won’t make friends pay pto better companies aren’t many incentives like pharmaceutical industry it’s good stepping stone people leave years work/life balance bonus perks boring atmosphere great place grow young career plan 50+ hour workweeks 60 appreciated pto ""unlimited"" never take 160 hrs get paid unused ""off"" fridays mean get work home lots talented dedicated folks - prepared dedicate work long hours positions paid overtime there's money made defense contracting takes getting used private sector little incentive efficiency lots rigid defined processes feel like impossible get things done lots turnover means there's opportunity advancement also stress inefficiency conformist environment great parental leave policy 60 hr weeks allow much time baby money talented co-workers 60 hr work weeks satisfaction depends factors cliquey lots turnover happens satisfaction depends group also depends projects assigned case management stays case however don’t get assigned “interesting” projects horrible project long time much fun working l3 adrenaline rush innovation i’m constantly inspired exciting work every day brings interesting new challenges problems exciting opportunities it’s best work dodn't care career pay bad culture non-appreciative leadership hard recognize people even small things work-life balance okay though 9/80 schedule gives every friday variable compensation (annual bonus) reserved higher grades challenging status quo company challenges status quo love every moment dynamic environment keeps engaged excited liked working non-traditional environments interesting tech creative people unleashing creativity working encourages creativity innovation making exciting playground turning ideas reality really enjoyed time highly recommend amazing team spirit team spirit contagious collaborate exciting projects make day exhilarating experience really like coworkers enjoy spending time every day thriving innovation hub innovation every day brings exciting challenges opportunities growth it’s invigorating! wouldn’t want work anywhere else"|0.18904023225451796|negative
Intellibus-2|nan|0.0|negative
Lockheed-Martin|move towards constantly changing goal better personally professionally safety oriented environment difficult company get easily best job i've ever clear downsides positives make dramatically excellent place work highly recommended people backgrounds flexible time work hours clocking clocking great supportive management culture telling people writing reports failures justified personally professionally cool 4/10 schedule compressed work schedule type employees work four 10-hour shifts instead five eight-hour days although employees still working 40-hour week schedule differs standard workweek work four days every seven-day week period love working lockheed martin best part working company? respect top everyone treated respect! stressful part working company? honestly stress position i'm sure work environment culture like company? lesbian culture open accepting typical day like company? typical day things flow flex time makes easy get work done wish could go back it’s far home best part working company? shift management people stressful part working company? didn’t experience stress working lmco work environment culture like company? great people helpful respectful committed one’s success typical day like company? clock work assigned tasks pressure produce quality product good slow cumbersome management overhead times good vacation time benefits bit lacking healthcare department good engineers generally meh management great work place easy talk people everyone willing help get stuffy lot read team might get easily bored always stretch assignments good good place work good benefits coworkers great great work life balance 4/10 schedule nice working 10 hours seemed long somtimes busy great place work good pay prospects advancement professional technical learning opportunities travel available employees want many locations available watch everyone camera 24/7 watch every move threaten suspend clearance don’t turn company badge worst company ever contracted exciting learning environment supportive co workers department little room growth left due amazing opportunity could resist ok room grow work challenging pace slow may due group internal support group left 11 months find higher growth opportunity great place work best part working company? life balance key todays work environment stressful part working company? sometimes deadline however time stress work environment culture like company? environment always good! typical day like company? working best folks around excellent company great benefits great pay great work life balance 4 day work week really nice opportunity remote work applicable positions great place work fast paced work environment lots opportunity growth lots people stay company entire career never look back! 10/10 fun slow slow work pace resistant modern tech stages essentially boring engineer wants innovate cool work spacecraft everyday decent job good benefits lockheed nice benefits package offers competitive pay however roles vastly different sometimes impossible deadlines management sometimes protect selves employees excellent work environment greatly enjoyed working lockheed martin left company opportunity presented current employer lockheed least time provided excellent benefits opportunities experiences test engineer good company get start/foot door plenty projects around broaden horizons best people ever worked awesome workplace even better people! i've working almost two years love it! everyone supportive truly want succeed look forward going work everyday laid-back culture interesting work work one major r&d divisions lm job provides everything traditionally want job much work interesting office culture laid-back supportive pay decent 4/10-flex schedule also godsend young looking adventure deep need self-actualize true passion necessarily technical research may best long-term choice (though fantastic schedule also means time personal development) however looking good stable job interesting work deeply passionate specific research area fantastic job hated job loved pay two teammates engineer sales rep never see finished product best part working company? pay time-off two teammates severance package stressful part working company? working engineers understand security compliance work environment culture like company? working cubicle structured environment; surprised random assignments typical day like company? fore part employees attending virtual meetings answering emails phone calls|0.30988888888888905|positive
Humana|great place great place work great work life balance overtime lot paid time plus well management laid back depending department working long drive great place work generous pto love department micromanaging however early retirements offered employees lots changes upper management including ceo retirement end 2024 pretty scary times everyone best job ever humana best job nurse respected professional work-life balance second none compensation fair pto exceptional compensation pto work-life balance work home great management support none think of! 1 depends leadership great experiences terrible ones going depend entirely boss style leadership attitude good ones provide great opportunity bad ones awful conservative culture pays well compensation good leadership culture formal hierarchical conservative maternity leave 6 weeks genuinely shameful reflects values great culture worked humana held two different positions first direct hire contract full time role humana care employees provide many perks encourage great working environment humana typical day humana depending position consists communication managers team members also going communicate clients departments working customers going gather information pull accounts verify everything completed communications client likely routed proper location finish documenting everything within system team meetings ways continue education good method professional experience within company work home ample training people available help needed good company culture humanity leadership stats negative calls fun undesirable job i’ve worked health care 10 years humana retention rate high beyond i’m fun job can’t meet numbers can’t get answers boss never get positive feedback even perfect something always need better even 100% audit never feels like enough i’m skilled nurse shouldn’t feel like inefficient waste time best part working company? met amazing people working leadership clueless stressful part working company? constant micro-managing lack competent leadership work environment culture like company? everyone walks around know really they’re correctly dysfunctional decent non customer facing position majority job researching cases see whether denied claims paid management shockingly bad work challenging figure productive fun place work enjoy everyday best part working company? allow freedom job mico manage always management ready help grow succeed stressful part working company? i'm field rep getting place place work environment culture like company? inclusive diverse cares members associates typical day like company? office visits meet key personnel reports follow conference calls work offices clinics resolve patient issues prescriptions inform offices / clinics services new medication patient assistance funding safe company anymore much overhead management 5 overhead rook per 1 developer role re-org every year - adding mangers director never invest people actual work ground like software engineer everyone want manager never care staying dedicate work horrible don’t work find job elsewhere overworked schedule change time management joke & stressed entire time good company recommend working humana great company good culture great environment great pay independent freedom find niche strong inclusive culture though lots changes many large companies organizational changes regular unsettling overall culture engagement wonderful people people want around ok ok metrics there's definitely favoritism little chance promotion regardless extra work put management slow implement changes laid back laid back environment employed company 6 years cool supervisor would loved stay position cut unfortunately didn’t option complete autonomy lucrative experience room make much desired best part working company? complete autonomy ability make schedule stressful part working company? sunset program due covid work environment culture like company? independent contractor didn’t lot contact others self assigned cases relied matrix feedback typical day like company? complete autonomy see clients provide needed care management great awesome fun totally great place work could’ve happier really love love trust believe productive good life work balance great coworkers overall company really good benefits work life balance good opportunities grow within company good benefits retirement contribution large distributed place experiences vary based work great place work i've opportunity grow learn build relationships intimidating hard build connections people working virtually supportive leader|0.29803923160173174|positive
