Company|Reviews|SCORE|SENTIMENT_LABEL
Leidos|supervision exceptional job military family life counselor supervisor possessed generous amount experience job past understood nuances able verbally guide challenges daily situation work satisfying rewarding working military members families mflcs also work closely military unit command staff members conduct briefing varying situations monthly lunch dates none 12 6 perfectly fine writing review open reviews company possibly joining leidos fine pretty standard contracting company good pay benefits room advancement positive challenging environment -every day poses new challenges keeping engaged developing professional knowledge -wonderful leadership throughout company -friendly work environment solid career coworkers great projects interesting benefits pretty good well 401k red tape pretty much unavoidable defense get enjoyable part getting leave definitely learned lot job although leads management always show interest helping employees provide enough guidance leidos committed excellence leidos top tier company superior ethos commitment excellence fairness teamwork diversity! would honored work leidos well recommend qualified candidates many mention! none known productive fun workplace great place work challenging times colleagues sometimes biding time opportunities look experience depends manager great company leidos great company work miss benefits mobility certain things site worked wanted get away good place work enjoyable part job teamwork workplace culture acceptable salary good reviews needed improvement acknowledgement needed improvement frequent touchpoint unclear communication management solid career government client job duties largely depend particular client work culture flexible compensation competitive construction industry team spread makes communication priority would recommend working best part working company? either accepted others lots favorites know stressful part working company? lack training things need know expect know everything expect never tell advance work environment culture like company? laid back crisis hits fan last minute typical day like company? working casual break times looking forward end day toxic wondering feel like work look toxic work environment online spot-on description better writing paragraphs working military flexible work schedule everything else repetitive unorganized upper management takes sort work knowing there's enough manpower complete pushes boatload work tight tight deadline great team geared growth team work fantastic supportive leidos whole good outlook allowing employees spread wings like see take advantage encouraged definitely recommend flexible hours great people around typical day work: 40-hour week core hours 9-3 computer day free get walk around please half design half paperwork going field also pretty nice management: they're good people work usually good word need one culture: open office plan consulting colleagues easy everyone supportive hardest part: tools processes slow workarounds make work tedious times best part: people hours office culture good people competitive good people decent management people care lot though direction corporate reflect plus pay low vs competitors nice company nice team members pay good especially stay many years increase 2-3% year always busy lot meetings great place remember contract work end contract close look new opportunities within outside company help really enough easy notes good pay stupid rules—like “counseling” one hand tied behind back best part working company? occasional raises (unrequested) easy notes independence stressful part working company? stupid rules management supportive appropriately trained company taking away perks incentivized desire work treated professional lack needed ability print technology issues lack appropriate devices outdated password management & 16-word passwords isolation lack professional support list goes & supposed ethical company “thrown bus” numerous occasions work environment culture like company? ok trying clue take contract like fine-tuning things see hire many experienced people transition going lose far people very-near future virgin pulse mental health options management could care less person professional development future company typical day like company? drive location deal emails technology feel schizophrenic two people overseeing work completely differing goals expectations see clients write easy notes outreach walking around non-medical counseling company makes bundles money us priority could pay us double instead taking away perks sub-par mflc pay leidos underpays mflcs compared counselors/therapists similar training region lots mflc’s leaving company boasts profits much $$ make leidos tone-deaf give us raises asked job great school-based counselor help many people leidos pretty much zero help “get started” new school “beg” office school pathetic schools won’t give office it’s disrespectful sends message “leidos won’t speak employee” basically fend good luck begging use copy machine stapler basically find teachers/school staff “feel sorry you” gather supplies don’t give adequate pto/sick days make work veteran’s day school session us “respecting” veterans? tell make $xxxxx much less get pay summer long school breaks “cute” job advertisement doesn’t clearly tell positive: many fellow mflcs (who might see month) caring people & counselors good team leads bad team lead life difficult favor go work somewhere get paid better get pto/sick leave company “racking profits” shouldn’t cheap employees big-wigs top property nice yachts lot employees work hard fulfilling job flexibility decent healthcare options underpaid deceptive pay pto|0.2381832146348277|negative
Wells-Fargo|nice place work job training phenomenal learned great deal never taken zoom classes everyone wells fargo main branch helped made training good experience later enrolled online classes atwgu due experience confidence coworkers given job training short staffed 3 okay good pay much work room growth treated great good work life balance much future cafeteria really nice amenities 1 great place work consistently wants upselling worked wells fargo 10 plus years good company tries best promote within remember pregnant 3rd son received 4 months fully paid promotion within yearly raises fair pay benefits jealous management 1 productive fun work place fast paced environment may receive 200 calls day frustrating also fun depending perspective always opportunity advancement culture fun encouraging basically get put forth work home benefits pay back back calls learning move quick good benefits get learn alot business helping business owners finances lending payroll merchant etc move always average great benefits - limited promotions great place work however promotions limited lately someone left higher position job simply gets closed moved state good pay benefits would worked till retired loyalty company unmatched laid warning help keep job 7 years company fantastic! best part working company? loved working there! management staff superb!0 stressful part working company? dealing extremely large cash deposits withdrawals mistkes made! several crosschecks absolutely necessary! i’m talking amounts excess $100000 work environment culture like company? absolutely amazing! teamwork dream work there! typical day like company? happy! love md waiting customers! loved building relationships! great place work room opportunity great work environment love employees plenty growth opportunities relocation opportunities team-based approach mean workplace people staying want severance package best part working company? used great place work awful terrible customer service leadership focused bonuses checkout stock price verification stressful part working company? worried you’ll lose job replaced someone india work environment culture like company? ruthless mean leaders concerned staff customers typical day like company? understaffed working 10-12 hour days decent place work decent place work pay better hours longer peak reporting hours normal line work reasonable workplace culture seem bad banks pay good feels dry though looking change want something feels invigorating okay place start call volume high mondays saturdays fridays it’s typical call center it’s okay place start stay job stepping stone put resume due name learned lot fun worked wells fargo leadership certainly favorites see much growth first manager relocated different branch point environment became much positive would overhear calls regional leadership would yelling store's sales goals would bring energy us branch floor manager great deal better managing team emotions promised managing role several months never came fruition submitted resignation miraculously management position became available think great professional growth plan place take time see move chain seems happen lot quicker men though overall fine good employer good life work balance average so-so salary many meetings limited amount people/time coding old technologies (eg java spring oracle react js ) terrible management far stressful job ever management favorites one reminded 100% replaceable daily basis also corporate looked exactly manager saw turn extremely high company addition involuntary layoffs none management corporate expectations wells fargo complete average everything like told constantly micromanaged death right place fundamentals & opportunities wf thee best training ever!!! don’t miss anything! provide great customer service every time lot opportunities lean grow whether it’s working call center branch supervisors great really heart people everyday different starting pay wasn’t enough experience strongly impacted quality caliber management loved working contact center much branch management driven team's metrics talking metrics everything! learn comfortable constant monitoring performance would normally hurt team members (if metrics good) unfortunately good metrics usually make big difference pay opportunities grow within company technology top line sure! given opportunity work home pandemic great quit required go back office relocate state nevada (from arizona) general experience positive negative wf treated well several close family members passed take time support relatives would definitely apply go back wf opportunity good managers metrics great script worked wf almost 7 yrs gave opportunity grow gain experience within financial industry training levels well thought cares customers employees management doesn’t really back constantly contradict tell meetings huddles know policies like back hand need approvals management make exceptions depends know hour lunch every holiday work life balance|0.24582614303504716|negative
S&P-Global|"company long history complex business model always striving innovate adapt ever changing business world company went major changes throughout tenure seen change it’s stock ticker symbol twice mhp mhfi spi time company focused attention finding sticking business core ultimately predominantly financial services business entities publishing education broadcasting spinned sold highest bidder along changes came mix poor decisions genius-like decisions poor judgement ranged way company outsourced cosourced work assignments know every major decision affect people one way another time well spend learned lot terms work ethic career enhancement constant structural changes 2 1 great place want learn lot best part working company? professional thoughtful trusting managers stressful part working company? it’s really big intimidated systems technology work environment culture like company? professional courteous clear concise typical day like company? log reconcile post check messages respond co workers managers document work flows report daily tasks occasional meetings pretty much sums questions best employer? committed employees well growth?great work life balance? gives birthday unlimited time off?market competitive salaries excellent place get door stay there! genuinely put people first compensation benefits unrivaled work isn’t terribly difficult management stays pretty hands unless needed lot hr benefits less score challenges looking good benefits one best company join terms growth challenging project; hard young employees manager senior managers better work redundancy good work life balance independence work clear reporting structure good compensation bonuses clear communication would better great team repetitive work really get work people world s&p offices everywhere people work home days office work abroad 30 days year benefits pretty good pay okay depends company decision making sometimes slow changes made quickly sometimes hard keep rate change working products repetitive limit skill development growth great work life balance s&p inclusive culture support opportunities advancement offer career coaching mentoring along average pay benefits okay laid within year employment without additional information blindsided everyone involved one warned us attended weekly call got news fully remote able work innovative projects put 2 projects weekly 2 stand ups new york city office amazing views great felt good coding great first full-time job great benefits work-life balance good environment every job depends team lucky really nice team really talented people good place jumpstart career new graduates offered job contractor assignment company (ihs markit) merged s&p global sure entire s&p organization (since merged directly employed s&p beginning) management/employees andover location initially part ihs markit s&p employees welcoming nice read keep mind organization might re-structured andover location following merger far review present major changes management/employees apart employees leaving search better opportunities mostly young new professionals get much role possible taking next step career far job goes hired contractor (not sure s&p use contractors moving forward) know role ""tax analyst"" working tax accounting rather work tax compliance opinion intellectually demanding job really exciting first 3-6 months got monotonous say work hard; lot daily tasks checking tax forms accuracy completeness making sure information complaint tax laws ultimately pretty much data entry day high volumes forms coming analyze form enter data system trained s&p side pertaining tax laws good workplace managers mess good place work career advancement opportunities better clear management needs less bossy play careers ego good first job good first job college lot learn great benefits great work culture low pay long hours alot work drama great benefits career growth consulting talk growth seems like still limited interesting opportunities given recently hired past problems yet fixed people work home still company benefits good extreme instability lack communication ruin otherwise great company 2017-2022 period non-stop mergers acquisitions lay-offs one knew really going whether job safe moved different managers/teams three times without consultation also told hundreds people eventually laid would new jobs company leadership prioritizes buzzwords rosy assessments reflect state organization ""organization"" really word used aside stomach putting aside good place work co-workers great diversity strong pay/benefits work flexibility good shame management poor great pay benefits work/life balance poor management poor communication disorganized leadership heavy siloing good company good benefits good pay modern company really good benefits culture great forward thinking management least area can't really speak areas great place work s&p good place work management decent receptive new ideas (at least far bigger organizations go) colleagues high caliber enjoy decent work/life balance productive workplace top ratings agency lot opportunities work various systems getting tune latest technologies methodologies required progress career good company good benefits organization really ahead caring employees best benefits i’ve seen leadership team strong cares employees takes time listen great team work best part working company? denver team management important growth department success team stressful part working company? impatient clients choose learn platform functions want answers trainings work environment culture like company? family friendly team management approach typical day like company? 8 hours answering training clients phone helping new associates understand corporate finance accounting"|0.2773779602750191|positive
Salesforce|high growth best tech best place learn sellexcellent technology strong marketing department base pay decent definitely place stay couple years leave come back higher base powerful company - yes company great incredible offices team etc pray good manager ended pushed mine completely ruined experience sales thanks review- we're sorry experience glad hear positives enjoyed tenure want employees feel valued supported leadership management teams know feedback seen right people ensure issues like addressed thank taking time share good company great people changing overall good work experience left changing environment getting large lead lot overlap politics pay benefits top notch stressed assistance management think company good overall company however department work great place work department lazy people get promoted recognized makes us work hard every day feel pretty deflated management good learning ground high pressure environment everyone best part working company? opportunity lot different things pay top industry especially sales roles stressful part working company? sales role - high pressure sales encourage nurtured accounts get swapped every year allow develop deep relationships customer dilutes engagement work environment culture like company? fast paced high pressure depending sf work different typical day like company? typical high pressure sales environment always chasing deals building pipeline two imporantant metrics (acv pipe) good company happy join high growth company worked 1 year plus good training opportunity good managers lots diversity inclusion great place start salesforce good company provide strong sales training prepared focus net new business sought great culture colleagues collaborative great package highly collaborative culture open communication great colleagues really good package well organised team high professionals innovative products dynamic environment work-life balance challenging great values short-sighted great civic engagement genuine caring employees focused enough (anymore) longer-term investments short-term profits over-corrected last year professional services salesforce professional services tries best falls short stress pressure cooker frequent changes reporting structure saleforce bought acumen become lowly no-culture acumen bean counter company great product pay crm product lot industry acceptance ceo knows keep wall street happy called culture high performance means pips widely encouraged really hard hit quota yoy really hard hit quotas cares numbers seen really great ae’s exceed quota one year let go next accounts looking cost savings get expensive good working really treated like another number dreamforce tried shake big boss hand ghosted overrated company good great place work great experience learn ton fast challenging grasp products managers team set success great career progression opportunities great company salesforce amazing benefits opportunities growth emphasis work life balance however found extremely unreasonable expectations put business development representatives early covid shutdowns businesses suffering sales slowed entire world changed salesforce adapted organizational issues i'd say unclear mentorship goals issues training junior engineers would recommend associates try another company productive great place work learn strongly recommend especially new well experienced professionals good management staff friendly colleagues fun place work loved experience really nice product; challenging amazing work able work remotely even better experience loved office too! best company never loved job great work environment beautiful office centrally located chicago company truly adheres values one best places work privilege working qa professional salesforce experience company nothing short exceptional salesforce organization exudes commitment excellence innovation genuine care employees made truly remarkable place work one standout aspects salesforce unwavering dedication employee growth development company places strong emphasis continuous learning providing numerous opportunities skill enhancement career advancement whether comprehensive training programs mentorship initiatives access cutting-edge tools technologies salesforce empowers employees thrive dynamic ever-evolving industry moreover work culture salesforce one welcoming inclusive i've ever encountered company values diversity actively fosters environment every voice heard celebrated inclusivity buzzword; deeply ingrained company's dna salesforce's commitment social responsibility equally commendable organization champions various philanthropic initiatives encouraging employees give back community sense purpose contributing something larger truly motivating ok work culture could feel connect company may fault dont know detailed training needs given new employee important|0.3313804713804713|positive
